<?xml version="1.0" encoding="UTF-8"?>
<data xmlns="http://www.woltlab.com" xmlns:xsi="http://www.w3.org/2001/XMLSchema-instance" xsi:schemaLocation="http://www.woltlab.com http://www.woltlab.com/XSD/6.0/option.xsd">
	<import>
		<categories>
			<!-- modules -->
			<category name="module">
				<showorder>1</showorder>
			</category>
			<category name="module.system">
				<parent>module</parent>
			</category>
			<category name="module.user">
				<parent>module</parent>
			</category>
			<category name="module.customization">
				<parent>module</parent>
			</category>
			<category name="module.content">
				<parent>module</parent>
			</category>
			<category name="module.community">
				<parent>module</parent>
			</category>
			<category name="module.development">
				<parent>module</parent>
			</category>
			<!-- /modules -->
			<!-- general -->
			<category name="general">
				<showorder>2</showorder>
			</category>
			<category name="general.page">
				<parent>general</parent>
				<showorder>1</showorder>
			</category>
			<category name="general.page.seo">
				<parent>general.page</parent>
			</category>
			<category name="general.page.sitemap">
				<parent>general.page</parent>
			</category>
			<category name="general.offline">
				<parent>general</parent>
				<showorder>2</showorder>
			</category>
			<category name="general.system">
				<parent>general</parent>
				<showorder>3</showorder>
			</category>
			<category name="general.system.ipAddress">
				<parent>general.system</parent>
			</category>
			<category name="general.system.error">
				<parent>general.system</parent>
			</category>
			<category name="general.system.cookie">
				<parent>general.system</parent>
			</category>
			<category name="general.system.http">
				<parent>general.system</parent>
			</category>
			<category name="general.system.packageServer">
				<parent>general.system</parent>
			</category>
			<category name="general.system.proxy">
				<parent>general.system</parent>
			</category>
			<category name="general.system.image">
				<parent>general.system</parent>
			</category>
			<category name="general.system.search">
				<parent>general.system</parent>
			</category>
			<category name="general.system.date">
				<parent>general.system</parent>
			</category>
			<category name="general.system.googleMaps">
				<parent>general.system</parent>
			</category>
			<category name="general.mail">
				<parent>general</parent>
				<showorder>4</showorder>
			</category>
			<category name="general.mail.general">
				<parent>general.mail</parent>
			</category>
			<category name="general.mail.send">
				<parent>general.mail</parent>
			</category>
			<category name="general.payment">
				<parent>general</parent>
				<showorder>6</showorder>
			</category>
			<category name="general.payment.paidSubscription">
				<parent>general.payment</parent>
			</category>
			<!-- /general -->
			<!-- user -->
			<category name="user">
				<showorder>3</showorder>
			</category>
			<category name="user.general">
				<parent>user</parent>
			</category>
			<category name="user.profile">
				<parent>user</parent>
			</category>
			<category name="user.avatar">
				<parent>user.profile</parent>
			</category>
			<category name="user.signature">
				<parent>user.profile</parent>
			</category>
			<category name="user.title">
				<parent>user.profile</parent>
			</category>
			<category name="user.cleanup">
				<parent>user.profile</parent>
			</category>
			<category name="user.list">
				<parent>user</parent>
			</category>
			<category name="user.list.members">
				<parent>user.list</parent>
			</category>
			<category name="user.list.online">
				<parent>user.list</parent>
			</category>
			<category name="user.register">
				<parent>user</parent>
			</category>
			<category name="user.3rdPartyAuth">
				<parent>user.register</parent>
			</category>
			<category name="user.password">
				<parent>user.register</parent>
			</category>
			<category name="user.ban">
				<parent>user.register</parent>
			</category>
			<!-- /user -->
			<!-- security -->
			<category name="security">
				<showorder>4</showorder>
			</category>
			<category name="security.general">
				<parent>security</parent>
			</category>
			<category name="security.general.session">
				<parent>security.general</parent>
			</category>
			<category name="security.general.authentication">
				<parent>security.general</parent>
			</category>
			<category name="security.general.secrets">
				<parent>security.general</parent>
				<showorder>15</showorder>
			</category>
			<category name="security.antispam">
				<parent>security</parent>
			</category>
			<category name="security.antispam.captcha">
				<parent>security.antispam</parent>
			</category>
			<category name="security.antispam.recaptcha">
				<parent>security.antispam</parent>
			</category>
			<category name="security.blacklist.sfs">
				<parent>security.antispam</parent>
			</category>
			<category name="security.censorship">
				<parent>security</parent>
			</category>
			<category name="message.censorship">
				<parent>security.censorship</parent>
			</category>
			<!-- /security -->
			<!-- message -->
			<category name="message">
				<showorder>5</showorder>
			</category>
			<category name="message.general">
				<parent>message</parent>
			</category>
			<category name="message.general.share">
				<parent>message.general</parent>
			</category>
			<category name="message.general.likes">
				<parent>message.general</parent>
			</category>
			<category name="message.general.poll">
				<parent>message.general</parent>
				<options>module_poll</options>
			</category>
			<category name="message.general.edit">
				<parent>message.general</parent>
			</category>
			<category name="message.general.image">
				<parent>message.general</parent>
			</category>
			<category name="message.general.imageProxy">
				<parent>message.general</parent>
			</category>
			<category name="message.general.unfurl">
				<parent>message.general</parent>
			</category>
			<category name="message.general.formatting">
				<parent>message.general</parent>
			</category>
			<category name="message.attachment">
				<parent>message</parent>
			</category>
			<category name="message.attachment.autoscale">
				<parent>message.attachment</parent>
			</category>
			<category name="message.sidebar">
				<parent>message</parent>
			</category>
			<category name="message.search">
				<parent>message</parent>
			</category>
			<category name="message.contactForm">
				<parent>message</parent>
			</category>
			<!-- /message -->
			<category name="dashboard"/>
			<category name="dashboard.content">
				<parent>dashboard</parent>
			</category>
			<category name="dashboard.sidebar">
				<parent>dashboard</parent>
			</category>
			<!-- cms -->
			<category name="cms"/>
			<category name="cms.media">
				<parent>cms</parent>
			</category>
			<category name="cms.media.thumbnail">
				<parent>cms.media</parent>
			</category>
			<category name="cms.article">
				<parent>cms</parent>
			</category>
		</categories>
		<options>
			<option name="last_update_time">
				<categoryname>general</categoryname>
				<optiontype>integer</optiontype>
				<defaultvalue>0</defaultvalue>
				<hidden>1</hidden>
			</option>
			<!-- value will automatically be replaced during WCFSetup -->
			<option name="wcf_uuid">
				<categoryname>general</categoryname>
				<optiontype>text</optiontype>
				<defaultvalue>bd096261-15f4-5dc1-9767-01ce08d7c80b</defaultvalue>
				<hidden>1</hidden>
			</option>
			<option name="woltlab_branding">
				<categoryname>general</categoryname>
				<optiontype>integer</optiontype>
				<defaultvalue>1</defaultvalue>
				<hidden>1</hidden>
			</option>
			<option name="first_time_setup_state">
				<categoryname>general</categoryname>
				<optiontype>integer</optiontype>
				<defaultvalue>0</defaultvalue>
				<hidden>1</hidden>
			</option>
			<option name="service_worker_public_key">
				<categoryname>hidden</categoryname>
				<optiontype>text</optiontype>
				<defaultvalue></defaultvalue>
				<hidden>1</hidden>
			</option>
			<option name="service_worker_private_key">
				<categoryname>hidden</categoryname>
				<optiontype>text</optiontype>
				<defaultvalue></defaultvalue>
				<hidden>1</hidden>
			</option>
			<option name="visitor_use_tiny_build">
				<categoryname>module.system</categoryname>
				<optiontype>boolean</optiontype>
				<defaultvalue>0</defaultvalue>
			</option>
			<option name="visitor_on_demand_session">
				<categoryname>module.system</categoryname>
				<optiontype>boolean</optiontype>
				<defaultvalue>0</defaultvalue>
			</option>
			<option name="module_article">
				<categoryname>module.content</categoryname>
				<optiontype>boolean</optiontype>
				<defaultvalue>1</defaultvalue>
			</option>
			<option name="module_smiley">
				<categoryname>module.customization</categoryname>
				<optiontype>boolean</optiontype>
				<defaultvalue>0</defaultvalue>
			</option>
			<option name="module_users_online">
				<categoryname>module.user</categoryname>
				<optiontype>boolean</optiontype>
				<defaultvalue>1</defaultvalue>
			</option>
			<option name="module_user_rank">
				<categoryname>module.user</categoryname>
				<optiontype>boolean</optiontype>
				<defaultvalue>1</defaultvalue>
			</option>
			<option name="module_user_signature">
				<categoryname>module.user</categoryname>
				<optiontype>boolean</optiontype>
				<defaultvalue>1</defaultvalue>
			</option>
			<option name="module_members_list">
				<categoryname>module.user</categoryname>
				<optiontype>boolean</optiontype>
				<defaultvalue>1</defaultvalue>
			</option>
			<option name="module_team_page">
				<categoryname>module.user</categoryname>
				<optiontype>boolean</optiontype>
				<defaultvalue>1</defaultvalue>
			</option>
			<option name="module_like">
				<categoryname>module.community</categoryname>
				<optiontype>boolean</optiontype>
				<defaultvalue>1</defaultvalue>